{
  "adapter_version": "1.0.0",
  "argv": [
    "forge",
    "test"
  ],
  "artifact_refs": [
    "sha256:4444444444444444444444444444444444444444444444444444444444444444"
  ],
  "capability_id": "cap_01J00000000000000000000001",
  "capability_version": "1.0.0",
  "created_at": "2026-08-12T12:00:00Z",
  "ended_at": "2026-08-12T12:01:00Z",
  "environment": [
    {
      "name": "FOUNDRY_PROFILE",
      "value": "ayran"
    }
  ],
  "evidence_ceiling": "observed",
  "exit_code": 0,
  "fork_identity_hash": "sha256:5555555555555555555555555555555555555555555555555555555555555555",
  "input_hashes": [
    "sha256:1111111111111111111111111111111111111111111111111111111111111111"
  ],
  "integrity": {
    "algorithm": "sha256",
    "canonicalization": "rfc8785",
    "content_hash": "sha256:2d6446419d0d422c686b83c362196b1d2bed60e0ec198e2d008c897f3b888e89",
    "excluded_fields": [
      "integrity.content_hash"
    ]
  },
  "limits": {
    "cpu": 4,
    "disk_mib": 4096,
    "memory_mib": 3072,
    "network": "none",
    "wall_seconds": 900
  },
  "normalized_evidence_ids": [
    "evd_01J00000000000000000000001"
  ],
  "parse_status": "parsed",
  "parser_version": "1.0.0",
  "provenance": [
    {
      "license_or_terms": "private-test-fixture",
      "provenance_id": "prv_01J00000000000000000000001",
      "raw_hash": "sha256:bbbbbbbbbbbbbbbbbbbbbbbbbbbbbbbbbbbbbbbbbbbbbbbbbbbbbbbbbbbbbbbb",
      "retrieved_at": "2026-08-12T12:00:00Z",
      "source_uri": "https://fixtures.ayran.dev/m0",
      "source_version": "fixture-v1",
      "transformation_lineage": []
    }
  ],
  "run_id": "run_01J00000000000000000000001",
  "schema_version": "1.0.0",
  "seed": 7,
  "signal": null,
  "started_at": "2026-08-12T12:00:00Z",
  "stderr_hash": "sha256:3333333333333333333333333333333333333333333333333333333333333333",
  "stdout_hash": "sha256:2222222222222222222222222222222222222222222222222222222222222222",
  "target_identity": {
    "commit": "1111111111111111111111111111111111111111",
    "scope_id": "scp_01J00000000000000000000001",
    "source_tree_hash": "sha256:dddddddddddddddddddddddddddddddddddddddddddddddddddddddddddddddd",
    "target_id": "tgt_01J00000000000000000000001"
  },
  "tool_name": "forge",
  "tool_run_id": "trn_01J00000000000000000000001",
  "tool_version": "1.7.1",
  "working_root": "run/work"
}
